ticker,code,date,sum_bart,sum_peg,sum_t5,vader,finbert,finbert_s,distil,distil_s,url
MANAPPURAM,531213,2025-04-16,"Voting results of Extra -Ordinary General Meeting held on Wednesday, 16th of A pril 2025. Scrutinizer’s Report, as required under the SEBI (Listing Obligations) Regulations, 2015.","The following is the full text of the voting results of the Extra-Ordinary General Meeting of Manappuram Finance Limited held on 16 April, 2017:",MANAPPURAM Finance Limited Extra Ordinary General Meeting - 04-04-2025 -,0,Neutral,1.0,NEGATIVE,0.99,https://www.bseindia.com/xml-data/corpfiling/AttachLive/6d84d3d3-f1e1-448d-837d-237ae9196e71.pdf
MANAPPURAM,531213,2025-04-16,"The voting result along with scrutin izer’s report will be released on April 16, 2025 at 10 a.m. (IST) through video conferencing / other audio -visual means.","The following is a copy of the letter sent by the auditor of Manappuram Finance Limited to the members of the Company for the Extra-Ordinary General Meeting of the Company held on Wednesday, April 16, 2025:","SEBI (as amended) Regulations, 2015, it is hereby informed that Extra Ordinary General Meeting of the Company was held on Wednesday, April 16, 2025 at 10.00 A.M. through VC/ OAVM. The Company Secretary of the Company welcomed the members of the Company. He informed them that in view of the circulars issued by Ministry of Corporate Affairs (“ MCA ”) and S",0,Neutral,1.0,NEGATIVE,0.989,https://www.bseindia.com/xml-data/corpfiling/AttachLive/0e67bce1-0ff7-4c9b-8700-df4c323aef8a.pdf
MANAPPURAM,531213,2025-04-15,"The statement of Debt Securities issued by the Company for half y ear ended on March 31, 2025. The statement was filed at the National Stock Exchange of India, Mumbai.","Dear Sir and Madam, we are enclosing herewith the half yearly statement of debt securities of Manappuram India International Exchange (IFSC) Ltd.","Sir/Madam, Please forward the following information to the following address: MANAPPURAM Finance Limited, IFSC, GIFT City, Gandhinagar – 382355",-7,Neutral,1.0,NEGATIVE,0.979,https://www.bseindia.com/xml-data/corpfiling/AttachLive/39f9d21c-3dd1-412a-bf2f-45281c1d6594.pdf
MANAPPURAM,531213,2025-04-11,"This is an advertisement regarding corrigendum to the notice convening Extra -ordinary General Meeti ng (“EGM”) of the members of the Company. The advertisement has been published in the following newspapers: The Indian Express, The Hindu, The Bombay Times and The Economic Times.","Dear Sir and Madam, we wish to inform you that the Extra-Ordinary General Meeting (EGM) of the members of the Company will be held on Wednesday, 16 April, 2025 at 10 A.M.","QUICKLY . Day trading guideThe outlook for the stock of Tata Consumer Products is bullish. The stock has risen about 2 per cent on T uesday when the broader markets remained subdued. The 200-Day Moving Average (DMA) at /uni20B91,053 has been giving good support for more than a week. The region between /uni20B91,050 and /uni20B91,040 is a strong support zone which has been limiting the downside well.",0,Neutral,1.0,NEGATIVE,0.995,https://www.bseindia.com/xml-data/corpfiling/AttachLive/ad73ce43-b29f-4ac4-8ab3-d6abb5247706.pdf
MANAPPURAM,531213,2025-04-11,"Certificate under Regulation 74 (5) of the SEBI (Depository and Participants) Regulation s 2018, for the quarter ended March 31,2025.                                            “Certificate’:   “Certificates of compliance with the rules and regulations of the Securities and Exchange Board of India’s (SEBI) Securities and Derivatives Act, 2010.”   “Authentic”: “The certificate of compliance is valid for the period of the quarter ending",We wish to inform you that the securities received from the depository participants for dematerialisation during the quarter ended 31st March 2025 have been confirmed (material/rejected ) to the depositories by us and that securities comprised in the said certificates have been listed on the stock exchanges where the earlier issued securities are listed.,"Dear Sir, Certificate under Regulation 74(5) of the SEBI (Depositions and Participants) Regulations, 2018 for the quarter ended March 31,2025. ISIN(S): INE522D01027 We hereby enclosed the confirmation certificate under Regulation 74(5) of the SEBI (Depositions and Parti cipants) Regulations, 2018 for the quarter ended March 31,2025, received from MUFG Intime India Private Limited (formerly known as Link Intime India Private Limited ), Registrar and Transfer Agent of the company . Further, we, certify that",52,Neutral,0.999,POSITIVE,0.99,https://www.bseindia.com/xml-data/corpfiling/AttachLive/3d146315-7ea3-43ec-95eb-342dd2deb47c.pdf
MANAPPURAM,531213,2025-04-10,"This is further to our letter dated March 22, 2025 , bearing reference n o. SEC/ SE/ 356/ 2024 –                 25. We are submitting the Notice of Extra -Ordinary General Meeting of the members of the Company to be held on Wednesday, April 16, 2025.","Dear Sir and Madam, we wish to inform you that the Extra-Ordinary General Meeting (EGM) of the Company will be held on Wednesday, 16 April, 2025 at 10 A.M.","1 | 2 Reference No.: SEC/SE/ 05/2025- 26 Date: April 10, 2025 BSE Limited Phiroze Jeejeebhoy Towers Dalal Street Mumbai – 400 001 Scrip Code: 531213 National Stock Exchange of India Limited 5th Floor, Exchange Plaza Bandra (East) Mumbai - 400 051 Scrip Code: MANAPPURAM India International Exchange (IFSC) Ltd 1st Floor, Unit No. 101, The Signature, Building no. 13B, Road 1C, Road 1C, Zone 1,",0,Neutral,1.0,NEGATIVE,0.912,https://www.bseindia.com/xml-data/corpfiling/AttachLive/86dfa3b9-ece1-4a49-a674-99fdc53e97f3.pdf
